[
  {
    "id": "improv-summary-steal-time",
    "module": "scenes",
    "scene": "improv",
    "group": "接话",
    "title": "做总结：偷出思考时间",
    "badge": "无准备接话",
    "quote": "接不上话时，先认可 + 复述，再衔接。",
    "how": "句式：你的意思是…我对这一点同意/想补充…。复述本身就是在组织下一句。",
    "dont": "沉默干瞪眼，或立刻反驳导致更卡。",
    "script": "你刚才说的核心是 ____，我补充一点…",
    "purpose": "关系维护",
    "sources": [
      {
        "label": "社交接话快慢",
        "href": "https://czh55.github.io/video-notes/quick-respond-conversation-图文实录.html",
        "repo": "video-notes"
      }
    ],
    "tags": [
      "即兴",
      "接话"
    ]
  },
  {
    "id": "improv-change-premise",
    "module": "scenes",
    "scene": "improv",
    "group": "接话",
    "title": "改变前提：掀翻对方假设",
    "badge": "进阶接话",
    "quote": "XX 只是一方面；如果我们把前提换成…",
    "how": "先点名对方隐含前提，再给出替代坐标系，让对方原有论据暂时失效。",
    "dont": "人身攻击或抬杠式否定一切。",
    "script": "这个判断成立的前提是____；如果前提是____，结论会变成…",
    "purpose": "利益推动",
    "sources": [
      {
        "label": "社交接话快慢",
        "href": "https://czh55.github.io/video-notes/quick-respond-conversation-图文实录.html",
        "repo": "video-notes"
      }
    ],
    "tags": [
      "即兴",
      "辩论"
    ]
  },
  {
    "id": "improv-keyword-speech",
    "module": "scenes",
    "scene": "improv",
    "group": "即兴专业度",
    "title": "关键词积木：5 分钟即兴",
    "badge": "专家证明",
    "quote": "把专家身份变成可测试的：关键词 → 抽签 → 即兴讲。",
    "how": "拜访前准备领域关键词；抽一个用结果→原因→行动讲 3 分钟，再推演「做不到的后果」。",
    "dont": "只背品牌名，现场答不上细节。",
    "script": "这个词我拆三句：结果是…根源在于…应对策略是…",
    "purpose": "利益推动",
    "sources": [
      {
        "label": "销售难题：怎么证明你们是专家",
        "href": "https://czh55.github.io/video-notes/prove-expert-sales-图文实录.html",
        "repo": "video-notes"
      }
    ],
    "tags": [
      "即兴",
      "销售"
    ]
  },
  {
    "id": "improv-three-sentence-live",
    "module": "scenes",
    "scene": "improv",
    "group": "结构即兴",
    "title": "被追问时：当场压成三句",
    "badge": "三句话定乾坤",
    "quote": "脑空白时不堆情绪，只填结果→原因→行动三个槽。",
    "how": "停半拍换气，第一句甩现状结果，第二句只留一个因，第三句给下一步。",
    "dont": "先道歉长篇铺垫再进入正题。",
    "script": "现在的情况是…；根源在于…；我接下来会…",
    "purpose": "结构训练",
    "sources": [
      {
        "label": "主持人跟练｜14天建立表达系统",
        "href": "https://czh55.github.io/video-notes/host-express-system-intro-图文实录.html",
        "repo": "video-notes"
      }
    ],
    "tags": [
      "即兴",
      "结构"
    ]
  },
  {
    "id": "vn-quick-respond-conversation",
    "module": "scenes",
    "scene": "improv",
    "group": "接话",
    "title": "社交接话快慢，暴露你的知识体系",
    "badge": "接话",
    "quote": "适用：社交闲聊、饭局讨论、观点交锋等非正式对话场景。",
    "how": "适用：社交闲聊、饭局讨论、观点交锋等非正式对话场景。；上限：不适用于工作汇报、谈判等需要严谨事实的场合，改变前提可能被当作诡辩。；反例：对方观点有事实硬伤时，直接摆事实比改前提更有说服力。",
    "dont": "",
    "script": "",
    "summary": "核心判断：接不上话不是临场反应差，而是知识体系储备不足的表现。补救靠两套话术结构：第一套「做总结」用复述偷出反应时间，第二套「改变前提」直接掀翻对方论点、让对方的积累失效；两套都是可反复使用的「无准备接话」框架。",
    "purpose": "关系维护",
    "sources": [
      {
        "label": "社交接话快慢，暴露你的知识体系",
        "href": "https://czh55.github.io/video-notes/quick-respond-conversation-图文实录.html",
        "repo": "video-notes"
      }
    ],
    "tags": [
      "video-notes",
      "接话"
    ]
  },
  {
    "id": "vn-prove-expert-sales",
    "module": "scenes",
    "scene": "improv",
    "group": "即兴专业度",
    "title": "销售难题：怎么证明你们是专家",
    "badge": "即兴专业度",
    "quote": "适用：销售、顾问、任何需要向客户证明专业能力的人。",
    "how": "适用：销售、顾问、任何需要向客户证明专业能力的人。；上限：50个关键词检验的是基本功，深度专业还要有真实案例、行业洞察与口碑。；反例：只背故事不练基本功，客户追问细节就会当场露馅。",
    "dont": "",
    "script": "",
    "summary": "核心判断：客户的信任只来自两个地方——品牌logo，或你当场证明的专业度。在大厂（通用电气）做销售，客户从不同「怎么证明你们是专家」，因为名片上的GE logo已经替你回答了，所以提成低、信任跟个人没半毛钱关系；到了创业公司，客户会直问：你说你是专家，怎么证明？电力局客户那句「选ABB、西门子、GE出问题也是正确选择，选你们选对了也是选错」道尽了小公司的处境。破解的办法是把专家身份变成可测试的：一张A4纸不间断写出50个独立关键词，随机抽一个做5分钟即兴演讲；再用SPIN思路升级——把关键词取反，把「没做到会有什么后果」推演得头头是道，拜访前准备好这些故事。",
    "purpose": "利益推动",
    "sources": [
      {
        "label": "销售难题：怎么证明你们是专家",
        "href": "https://czh55.github.io/video-notes/prove-expert-sales-图文实录.html",
        "repo": "video-notes"
      }
    ],
    "tags": [
      "video-notes",
      "即兴专业度"
    ]
  },
  {
    "id": "vn-7FNwup3V9Db",
    "module": "scenes",
    "scene": "improv",
    "group": "演讲开场",
    "title": "演讲开场如何抓住听众的注意力?",
    "badge": "演讲开场",
    "quote": "下次演讲准备时，删掉自我介绍第一句，换成一个与主题相关的惊人事实或数字",
    "how": "下次演讲准备时，删掉自我介绍第一句，换成一个与主题相关的惊人事实或数字；对着手机录音练习「说数字→停顿2秒→复述」的节奏，直到这两个停顿不再让你紧张；设计一个举手问题，提前预判现场可能出现的各种答案分布，并准备回应台词",
    "dont": "",
    "script": "",
    "summary": "核心命题：开场不是介绍自己，而是用意外信息制造认知缺口，让听众主动想听下去。",
    "purpose": "利益推动",
    "sources": [
      {
        "label": "演讲开场如何抓住听众的注意力?",
        "href": "https://czh55.github.io/video-notes/7FNwup3V9Db-图文实录.html",
        "repo": "video-notes"
      }
    ],
    "tags": [
      "video-notes",
      "演讲开场"
    ]
  }
]
